place_rank,place_id,place_name,place_blog_cnt,place_visit_cnt,place_category,place_industry,place_score,place_save_cnt,place_detail_keyword,place_open,place_index1,place_index2,place_index3,place_rank_jump,place_rank_compare,place_blog_cnt_compare,place_visit_cnt_compare,place_save_cnt_compare,place_gdid_inde1_compare,place_gdid_inde2_compare,place_gdid_inde3_compare
1,1941978270,트리움치과의원,3091,541,치과,건강의료>병원>병원의원>치과>치과-일반,0.0,,강동구치과 송파구인비절라인투명치아교정 디지털네비게이션임플란트 수면무통매복사랑니당일발치 성내동365무삭제라미네이트,,0.33134,0.484322,0.398568,,0,272.0,26.0,,0.0177,-0.003638,0.006405
2,1861445310,서울와이드치과의원 강동암사점,2474,653,치과,건강의료>병원>병원의원>치과>치과-일반,0.0,,강동구치과 뼈이식3D네비게이션임플란트 사랑니발치틀니보철치료 인비절라인투명치아교정 앞니치아미백,,0.33134,0.47875,0.398147,,7,353.0,0.0,,0.0177,0.047787,0.010286
3,1154632626,닥터재일치과의원,2423,2610,치과,건강의료>병원>병원의원>치과>치과-일반,0.0,,수면무통마취치과 임플란트염증재수술 충치신경보존잇몸치료 완전매복사랑니발치 턱관절장애통증장치치료,,0.33134,0.467194,0.397275,,-1,203.0,16.0,,0.0177,-0.006701,0.006174
4,1414402137,연세꿈꾸는치과교정과의원 강동둔촌점,2511,985,치과,건강의료>병원>병원의원>치과>치과-일반,0.0,,디지털네비게이션임플란트 수평매복사랑니당일발치 무삭제라미네이트 투명치아교정 강동구교정치과,,0.33134,0.466994,0.39726,,-1,154.0,111.0,,0.0177,0.015281,0.007833
5,1989758373,디어스치과의원,2464,1132,치과,건강의료>병원>병원의원>치과>치과-일반,0.0,,강동구치과 명일역치과 원데이임플란트발치 교정잇몸치료 무삭제라미네이트,,0.33134,0.456831,0.396493,,2,416.0,6.0,,0.0177,0.018648,0.008087
6,1080959331,서울더자연치과의원,2024,1863,치과,건강의료>병원>병원의원>치과>치과-일반,0.0,,강동구임플란트 명일동수면치과 암사동수면임플란트 명일역전체임플란트 천호무삭제라미네이트,,0.33134,0.44372,0.395503,,6,335.0,40.0,,0.0177,0.032294,0.009116
7,12038819,아이엠치과병원,2823,443,치과,건강의료>병원>병원의원>치과>치과-일반,4.24,,강동구치과 천호치과 강동구치아교정 강동구임플란트 강동치과,,0.33134,0.442048,0.395377,,-3,135.0,3.0,,0.0177,-0.008051,0.006071
8,1173075708,연세남기세치과의원,1983,329,치과,건강의료>병원>병원의원>치과>치과-일반,4.9,,길동치과 강동구치과 법랑질치아성형 친수성임플란트 파크포레온치과,,0.33134,0.440164,0.395235,,-3,231.0,3.0,,0.0177,-0.005981,0.006228
9,1477774158,365서울바로치과의원,2852,511,치과,건강의료>병원>병원의원>치과>치과-일반,0.0,,강동구치과 성내동치과 둔촌동치과 임플란트 턱관절,,0.33134,0.437403,0.395027,,-1,188.0,4.0,,0.0177,0.002234,0.006848
10,13462471,미소탑치과의원,4624,421,치과,건강의료>병원>병원의원>치과>치과-일반,4.51,,충치치료 임플란트 사랑니발치 교정치료 라미네이트,,0.331294,0.436156,0.394915,,-4,193.0,4.0,,0.0177,-0.002968,0.006455
11,1291499437,서울더고운치과의원 강일점,1138,232,치과,건강의료>병원>병원의원>치과>치과-일반,0.0,,강일동치과 강일동임플란트 신경치료 상일동치과 강동구치과,,0.33134,0.43087,0.394534,,0,325.0,5.0,,0.0177,0.011302,0.007533
12,38004385,강동씨엘치과의원,1129,670,치과,건강의료>병원>병원의원>치과>치과-일반,4.49,,강동구치과 강동구소아치과 길동치과 길동소아치과 강동구교정치과,,0.33134,0.412402,0.39314,,-2,-5.0,9.0,,0.0177,-0.010549,0.005883
13,1138434454,온아치과의원 천호역점,1520,868,치과,건강의료>병원>병원의원>치과>치과-일반,0.0,,강동구치과 임플란트 천호역치과 수면치료 미백치료,,0.33134,0.401478,0.392315,,2,135.0,19.0,,0.0177,0.008631,0.00733
14,1093010130,연세송병재치과교정과의원,537,93,치과,건강의료>병원>병원의원>치과>치과-일반,0.0,,연세송병재치과 둔촌동교정치과 인비절라인투명교정 연세송병재교정치과 강동구치아교정전문치과,,0.33134,0.386723,0.391202,,0,43.0,5.0,,0.0177,-0.016964,0.005399
15,20596721,센트럴뉴욕치과의원,1582,802,치과,건강의료>병원>병원의원>치과>치과-일반,0.0,,천호동치과 충치보철치료 뼈이식임플란트 스케일링 사랑니,,0.33134,0.37814,0.390554,,1,90.0,4.0,,0.0177,-0.005811,0.006241
16,1466996753,서울닥터호치과교정과치과의원,1145,514,치과,건강의료>병원>병원의원>치과>치과-일반,0.0,,인비절라인 서울닥터호교정치과 치아교정 교정치과 턱교정,,0.33134,0.377096,0.390475,,1,64.0,28.0,,0.0177,-0.003768,0.006395
17,1499918152,라이프치과의원,1325,271,치과,건강의료>병원>병원의원>치과>치과-일반,4.77,,길동치과 암사동치과 강동구치과 임플란트 심미보철,,0.33134,0.369458,0.389899,,4,150.0,0.0,,0.0177,0.011221,0.007527
18,31332427,예스미르치과의원,454,504,치과,건강의료>병원>병원의원>치과>치과-일반,4.6,,강동구임플란트 임플란트 고덕동치과 충치치료 사랑니발치,,0.33134,0.36777,0.389771,Hot,10,0.0,11.0,,0.0177,0.048609,0.010348
19,1370115174,서울바르디치과의원,2362,1568,치과,건강의료>병원>병원의원>치과>치과-일반,0.0,,강동구치과 3D네비게이션임플란트치과 강동구어린이치아교정치과 인비절라인투명교정치과 틀니보철충치신경치료,,0.33134,0.367261,0.389733,,-1,-12.0,2.0,,0.0177,-0.009963,0.005927
20,21697600,다홍치과의원,1264,218,치과,건강의료>병원>병원의원>치과>치과-일반,0.0,,턱관절보톡스 매복사랑니발치 임플란트틀니 앞니충치구강스캐너 치아교정치과,,0.33134,0.366778,0.389697,,-7,130.0,1.0,,0.0177,-0.03767,0.003837
21,615577457,코랄치과의원,2245,674,치과,건강의료>병원>병원의원>치과>치과-일반,4.48,,강동구교정치과 강동구치아교정 강동구치과 성내동치과 올림픽파크포레온치과,,0.33134,0.352943,0.388652,,-2,7.0,0.0,,0.0177,-0.009587,0.005955
22,1465261874,한울치과보철과치과의원,2245,748,치과,건강의료>병원>병원의원>치과>치과-일반,0.0,,치과 임플란트 보철치료 충치치료 강동구치과,,0.33134,0.348556,0.388321,,8,26.0,22.0,,0.0177,0.034697,0.009298
23,11832425,연세진치과의원 강동,258,495,치과,건강의료>병원>병원의원>치과>치과-일반,0.0,,강동구치과 무절개임플란트 강동구교정치과 둔촌동치과 포레온교정치과,,0.33134,0.345059,0.388057,,0,-100.0,22.0,,0.0177,0.00453,0.007021
24,37089925,이앤유치과의원,808,399,치과,건강의료>병원>병원의원>치과>치과-일반,4.85,,임플란트 치아교정 천호동 천호역 치과,,0.33134,0.341477,0.387787,,0,4.0,2.0,,0.0177,0.003593,0.006951
25,1057370743,명일도담치과의원,531,363,치과,건강의료>병원>병원의원>치과>치과-일반,4.92,,치과 임플란트 틀니 충치치료 도담치과,,0.33134,0.339487,0.387637,,0,11.0,1.0,,0.0177,0.012866,0.007651
26,1902958869,허니플란트치과의원,1001,193,치과,건강의료>병원>병원의원>치과>치과-일반,4.4,,강동역치과 성내동치과 네비게이션임플란트 사랑니발치 충치치료,,0.33134,0.333244,0.387166,,-4,-1.0,0.0,,0.0177,-0.018277,0.0053
27,1030631332,서울돌봄치과의원 강동암사점,401,41,치과,건강의료>병원>병원의원>치과>치과-일반,0.0,,어린이레진빌드업치료 디지털수면마취임플란트 키즈턱관절교정용보톡스 사랑니전문무통발치 민생회복지원금소비쿠폰,,0.331294,0.323406,0.386406,,-7,29.0,0.0,,0.0177,-0.037829,0.003824
28,36324816,서울길치과의원,447,343,치과,건강의료>병원>병원의원>치과>치과-일반,4.63,,,,0.331294,0.319544,0.386114,,-1,14.0,0.0,,0.0177,-0.000267,0.006659
29,1111708596,서울S치과의원,648,898,치과,건강의료>병원>병원의원>치과>치과-일반,4.7,,고덕동치과 상일동치과 고덕동교정 고덕동임플란트 임플란트,,0.33134,0.317832,0.386003,,0,0.0,5.0,,0.0177,-0.000115,0.006671
30,1182976305,서울굿닥터치과의원,211,460,치과,건강의료>병원>병원의원>치과>치과-일반,0.0,,충치신경보존치료 수면무통마취치과 턱관절치료 임플란트염증재수술 매복사랑니발치,,0.33134,0.309545,0.385377,,7,0.0,1.0,,0.0177,0.027532,0.008757
31,1383478329,천호온사랑치과의원,962,152,치과,건강의료>병원>병원의원>치과>치과-일반,0.0,,보험틀니 신경치료 천호치과 임플란트 사랑니발치,,0.33134,0.304376,0.384987,,-5,54.0,1.0,,0.0177,-0.018665,0.005271
32,1763028122,고우넷치과교정과치과의원,66,76,치과,건강의료>병원>병원의원>치과>치과-일반,0.0,,천호치아교정 고우넷치과 무턱교정 돌출입교정 천호교정치과,,0.33134,0.30016,0.384669,,0,1.0,3.0,,0.0177,0.002972,0.006904
33,11600487,아이세상치과의원 강동점,67,423,치과,건강의료>병원>병원의원>치과>치과-일반,4.5,,강동구소아치과 천호동소아치과 강동구어린이치과 소아치과 교정,,0.33134,0.298817,0.384567,,1,2.0,8.0,,0.0177,0.00752,0.007247
34,1189468083,연세타이밍치과의원 강동구길동,627,541,치과,건강의료>병원>병원의원>치과>치과-일반,4.9,,장애인치과주치의 사랑니무통마취 디지털임플란트염증 구강조직병리검사 학생아동구강검진,,0.33134,0.298405,0.384536,,-3,0.0,10.0,,0.0177,-0.006598,0.006181
35,1103267884,서울오케이치과의원 고덕점,176,834,치과,건강의료>병원>병원의원>치과>치과-일반,4.71,,고덕동치과 상일동치과 사랑니발치 치아교정 상일동역치과,,0.33134,0.296452,0.384389,,-2,1.0,9.0,,0.0177,-9.1e-05,0.006673
36,536278339,연세웰주니어치과의원 강동 명일역점,358,465,치과,건강의료>병원>병원의원>치과>치과-일반,4.57,,강동구소아치과 치아스케일링 영유아구강검진 강동구치과 강동구어린이교정,,0.33134,0.294294,0.384226,,7,4.0,4.0,,0.0177,0.03761,0.009518
37,13156514,연세조이플란트치과의원,385,68,치과,건강의료>병원>병원의원>치과>치과-일반,4.44,,강동구청역치과 성내동치과 강동구치과 성내동임플란트 강동구청역임플란트,,0.33134,0.293527,0.384168,,-2,-3.0,6.0,,0.0177,0.008034,0.007286
38,1580955767,높은덕치과의원,48,907,치과,건강의료>병원>병원의원>치과>치과-일반,4.86,,상일동치과 상일동역치과 아르테온치과 임플란트 치아교정,,0.33134,0.282673,0.383349,,2,0.0,1.0,,0.0177,0.00913,0.007368
39,1946157412,연세우주치과의원,254,620,치과,건강의료>병원>병원의원>치과>치과-일반,0.0,,강동구강내과 강동구턱관절 강일동턱관절 미사턱관절 강일동임플란트,,0.331294,0.280105,0.383138,,-3,0.0,2.0,,0.0177,-0.003068,0.006448
40,1370478683,시그니처치과교정과치과의원,167,303,치과,건강의료>병원>병원의원>치과>치과-일반,4.78,,교정치과 치아교정 동적교합 부정교합 인비절라인,,0.33134,0.277459,0.382955,,1,4.0,1.0,,0.0177,0.012569,0.007628
41,36132782,연세미래엔미소치과병원,442,342,치과,건강의료>병원>병원의원>치과>치과-일반,4.68,,임플란트 치아교정 인비절라인 라미네이트 치과병원,,0.33134,0.276788,0.382905,,3,0.0,0.0,,0.0177,0.020335,0.008214
42,1392543081,고덕아이온소아치과치과의원,51,765,치과,건강의료>병원>병원의원>치과>치과-일반,0.0,,고덕소아치과 고덕어린이치과 상일소아치과 상일어린이치과 강일어린이치과,,0.33134,0.275138,0.38278,,-4,0.0,5.0,,0.0177,-0.005977,0.006228
43,36424700,연세키즈사랑치과의원,100,261,치과,건강의료>병원>병원의원>치과>치과-일반,4.41,,연세키즈사랑치과 강동구어린이치과 암사동어린이치과 강동구소아치과 강동구키즈치과,,0.33134,0.26136,0.38174,,5,0.0,0.0,,0.0177,0.014452,0.00777
44,11713098,효치과의원,47,188,치과,건강의료>병원>병원의원>치과>치과-일반,4.57,,둔촌동치과 강동구치과 강동구임플란트 둔촌동임플란트 둔촌동신경치료,,0.33134,0.258495,0.381524,,-2,0.0,2.0,,0.0177,0.000428,0.006712
45,243031887,명일제일치과의원,471,324,치과,건강의료>병원>병원의원>치과>치과-일반,4.85,,명일제일치과 사랑니발치 네비게이션임플란트 라미네이트 보철치료,,0.33134,0.250525,0.380923,,-6,49.0,0.0,,0.0177,-0.023474,0.004908
46,1088829448,연세우주아이정치과의원,238,665,치과,건강의료>병원>병원의원>치과>치과-일반,5.0,,상일동소아교정 미사소아교정 강일동소아치과 강일동교정치과 성장기교정,,0.33134,0.249638,0.380856,,1,3.0,9.0,,0.0177,0.000704,0.006733
47,11606775,강동맑은치과의원,483,335,치과,건강의료>병원>병원의원>치과>치과-일반,4.61,,임플란트 사랑니발치 턱관절치료 천호역치과 성내동치과,,0.33134,0.248422,0.380764,,-1,4.0,4.0,,0.0177,-0.002484,0.006492
48,11544238,연세메이트치과의원,166,1512,치과,건강의료>병원>병원의원>치과>치과-일반,4.56,,뼈이식임플란트 미세현미경충치치료 교정치과 어린이소아치과 의식하진정요법,,0.33134,0.247077,0.380662,,5,1.0,13.0,,0.0177,0.010846,0.007498
49,1650674095,대학치과의원 천호,690,91,치과,건강의료>병원>병원의원>치과>치과-일반,0.0,,강동역치과 천호동치과 강동구치과 강동구임플란트 강동구충치치료,,0.33134,0.243023,0.380357,,1,3.0,3.0,,0.0177,-0.001128,0.006595
50,11597821,베스트치과의원,41,295,치과,건강의료>병원>병원의원>치과>치과-일반,0.0,,천호역임플란트 천호역부정교합 천호역라미네이트 천호동사랑니,,0.331294,0.242957,0.380334,,-5,1.0,0.0,,0.0177,-0.012008,0.005773
